id,title,description,link,image_link,price,availability,condition,brand,mpn,google_product_category,product_type
invitatie-nunta-aurie-pliabila-001,Invitatie nunta eleganta cu accente aurii,"Invitatie de nunta eleganta, realizata din carton premium, cu aurii rafinate. Model pliabil, cu layout aerisit si sectiuni clare pentru programul evenimentului, confirmare si dress code.",https://boundlesscollection.ro/p/invitatie-nunta-eleganta-cu-accente-aurii-invitati.html,https://boundlesscollection.ro/images/invitatii/invitatie-nunta-aurie-pliabila.jpeg,4.99 RON,in stock,new,Boundless Collection,invitatie-nunta-aurie-pliabila-001,Home & Garden > Decor > Decorative Objects,invitatii
invitatie-nunta-calendar-roz-001,Invitatie de nunta florala cu calendar si fundita roz,"Invitatie de nunta eleganta, cu design floral romantic in stil acuarela, personalizata cu numele mirilor si data evenimentului sub forma de calendar. Invitatie tip card pliat, decorata cu fundita roz delicata.",https://boundlesscollection.ro/p/invitatie-de-nunta-florala-cu-calendar-si-fundita-roz-invitati.html,https://boundlesscollection.ro/images/invitatii/invitatie-florala-calendar-roz-3.png,4.00 RON,in stock,new,Boundless Collection,invitatie-nunta-calendar-roz-001,Arts & Entertainment > Party Supplies > Invitations,invitatii
invitatie-nunta-eucalipt-verde-001,Invitatie de nunta Eucalipt verde cu cerc auriu,"Invitatie de nunta eleganta, cu design floral in nuante de verde eucalipt si cerc auriu, ilustratie cu miri si detalii fine. Invitatie personalizabila cu nume, data si text, legata cu fundita verde satinata. Ideala pentru o nunta moderna, naturala si rafinata.",https://boundlesscollection.ro/p/invitatie-de-nunta-eucalipt-verde-cu-cerc-auriu-invitati.html,https://boundlesscollection.ro/images/invitatii/invitatie-eucalipt-verde-3.jpg,4.00 RON,in stock,new,Boundless Collection,invitatie-nunta-eucalipt-verde-001,Arts & Entertainment > Hobbies & Creative Arts > Party Supplies > Invitations,invitatii
invitatie-carte-aurie-001,Invitatie de nunta aurie tip carte,"Invitatie de nunta eleganta, cu accente aurii rafinate si design romantic. Invitatie personalizabila cu numele mirilor, data evenimentului si detaliile ceremoniei, realizata pe carton premium, cu funda satinata aurie. Alegerea ideala pentru nunti clasice, elegante si rafinate.",https://boundlesscollection.ro/p/invitatie-de-nunta-aurie-tip-carte-invitati.html,https://boundlesscollection.ro/images/invitatii/invitatie-carte-aurie-3.jpg,4.00 RON,in stock,new,Boundless Collection,invitatie-carte-aurie-001,Arts & Entertainment > Party Supplies > Invitations,invitatii
invitatie-carte-albastra-001,Invitatie de nunta albastra,"Invitatie de nunta eleganta cu flori albastrei. Design romantic cu ilustratie miri, calendar personalizat si fundita satinata albastra. Ideala pentru o nunta rafinata si memorabila.",https://boundlesscollection.ro/p/invitatie-de-nunta-albastra-invitati.html,https://boundlesscollection.ro/images/invitatii/invitatie-albastra-3.jpg,4.00 RON,in stock,new,Boundless Collection,invitatie-carte-albastra-001,Arts & Entertainment > Party Supplies > Invitations,invitatii
invitatie-sigiliu-ceara-flori-uscate-001,Invitație de botez cu sigiliu din ceară și flori uscate,"Invitație de botez realizată manual, pe carton premium în nuanțe delicate, legată cu sfoară decorativă și sigilată cu ceară. Decorată cu flori uscate naturale, atent selecționate, pentru un aspect elegant și rafinat.",https://boundlesscollection.ro/p/invitatie-de-botez-cu-sigiliu-din-ceara-si-flori-uscate-invitati.html,https://boundlesscollection.ro/images/invitatii/invitatie-botez-sigiliu-flori-uscate-1.jpg,6.99 RON,in stock,new,Boundless Collection,invitatie-sigiliu-ceara-flori-uscate-001,Arts & Entertainment > Party & Celebration > Invitations,invitatii
invitatie-poza-calc-roz-002,Invitație de botez cu fotografie și foaie de calc,"Invitație de botez cu design modern și delicat, realizată pe carton foto, completată de o foaie de calc imprimată care adaugă un efect elegant și aerisit. Fotografia este integrată armonios în design, iar invitația este finisată cu o fundiță din organza, pentru un plus de rafinament.",https://boundlesscollection.ro/p/invitatie-de-botez-cu-fotografie-si-foaie-de-calc-invitati.html,https://boundlesscollection.ro/images/invitatii/invitatie-botez-foto-foaie-de-calc-roz.jpg,4.50 RON,in stock,new,Boundless Collection,invitatie-poza-calc-roz-002,Arts & Entertainment > Party & Celebration > Invitations,invitatii
invitatie-ursulet-bleu-003,Invitație de botez pentru băiețel cu ursuleț și fundiță bleu,"Invitație delicată pentru botezul băiețelului, realizată pe carton premium, cu ilustrație de ursuleț în tonuri pastel și fundiță bleu aplicată manual. Designul aerisit și cromatica blândă creează o invitație elegantă, potrivită unui eveniment special dedicat celor mici.",https://boundlesscollection.ro/p/invitatie-de-botez-pentru-baietel-cu-ursulet-si-fundita-bleu-invitati.html,https://boundlesscollection.ro/images/invitatii/invitatie-botez-ursulet-fundita-bleu.jpg,4.50 RON,in stock,new,Boundless Collection,invitatie-ursulet-bleu-003,Arts & Entertainment > Party & Celebration > Invitations,invitatii
invitatie-fundita-rosie-calc-004,Invitație de botez cu fundiță roșie și foaie de calc,"Invitație elegantă realizată pe carton premium, completată de un înveliș din foaie de calc semitransparentă și fundiță roșie din organza. Designul clasic, cu accente fine, oferă o prezentare rafinată și potrivită pentru evenimente tematice.",https://boundlesscollection.ro/p/invitatie-de-botez-cu-fundita-rosie-si-foaie-de-calc-invitati.html,https://boundlesscollection.ro/images/invitatii/invitatie-botez-fundita-rosie-foaie-calc.jpg,6.00 RON,in stock,new,Boundless Collection,invitatie-fundita-rosie-calc-004,Arts & Entertainment > Party & Celebration > Invitations,invitatii
invitatie-carticica-albastra-005,Invitație de botez tip cărticică cu fundiță albastră,"Invitație tip cărticică realizată pe carton premium, cu fotografie și detalii de eveniment, legată cu fundiță albastră din organza. Design delicat, potrivit pentru botez de băiețel.",https://boundlesscollection.ro/p/invitatie-de-botez-tip-carticica-cu-fundita-albastra-invitati.html,https://boundlesscollection.ro/images/invitatii/invitatie-botez-tip-carticica-fundita-albastra.jpg,4.00 RON,in stock,new,Boundless Collection,invitatie-carticica-albastra-005,Arts & Entertainment > Party & Celebration > Invitations,invitatii
invitatie-ursulet-ivoire-006,Invitație de botez cu ursuleț și fundiță ivoire,"Invitație realizată pe carton premium, decorată cu ursuleț și nori în tonuri pastel, completată cu fundiță ivoire din organza. Design delicat, ideal pentru botez de băiețel.",https://boundlesscollection.ro/p/invitatie-de-botez-cu-ursulet-si-fundita-ivoire-invitati.html,https://boundlesscollection.ro/images/invitatii/invitatie-botez-ursulet-fundita-ivoire.jpg,4.00 RON,in stock,new,Boundless Collection,invitatie-ursulet-ivoire-006,Arts & Entertainment > Party & Celebration > Invitations,invitatii
invitatie-ursulet-roz-007,Invitație de botez cu ursuleț și fundiță roz,"Invitație realizată pe carton premium, decorată cu ursuleț și baloane în tonuri pastel, legată cu fundiță roz din satin. Design dulce și elegant, ideal pentru botez de fetiță.",https://boundlesscollection.ro/p/invitatie-de-botez-cu-ursulet-si-fundita-roz-invitati.html,https://boundlesscollection.ro/images/invitatii/invitatie-botez-ursulet-fundita-roz.jpg,4.00 RON,in stock,new,Boundless Collection,invitatie-ursulet-roz-007,Arts & Entertainment > Party & Celebration > Invitations,invitatii
invitatie-pergament-smarald-008,Invitație pergament cu fundiță verde smarald,"Invitație tip pergament, rulată și legată manual cu fundiță verde smarald din organza. Stil minimalist cu vibe natural, ideal pentru nuntă.",https://boundlesscollection.ro/p/invitatie-pergament-cu-fundita-verde-smarald-invitati.html,https://boundlesscollection.ro/images/invitatii/invitatie-pergament-verde-smarald.jpg,4.00 RON,in stock,new,Boundless Collection,invitatie-pergament-smarald-008,Arts & Entertainment > Party & Celebration > Invitations,invitatii
invitatie-safari-plic-verde-009,Invitație botez Safari cu plic verde,"Invitație de botez tematică Safari, realizată pe carton premium mat, cu animale de junglă și frunze tropicale. Completată de plic verde decupat tip frunză, pentru un aspect vesel și unitar.",https://boundlesscollection.ro/p/invitatie-botez-safari-cu-plic-verde-invitati.html,https://boundlesscollection.ro/images/invitatii/invitatie-botez-safari-plic-verde.jpg,9.00 RON,in stock,new,Boundless Collection,invitatie-safari-plic-verde-009,Arts & Entertainment > Party & Celebration > Invitations,invitatii
invitatie-nunta-ziar-010,Invitație nuntă tip Ziar,"Invitație de nuntă tip ziar, cu design retro inspirat din reviste, printată pe carton mat și legată cu sfoară naturală. Un model creativ, cu aspect editorial, care spune povestea mirilor într-un mod original.",https://boundlesscollection.ro/p/invitatie-nunta-tip-ziar-invitati.html,https://boundlesscollection.ro/images/invitatii/invitatie-nunta-jurnal.jpg,5.99 RON,in stock,new,Boundless Collection,invitatie-nunta-ziar-010,Arts & Entertainment > Party & Celebration > Invitations,invitatii
invitatie-ursulet-bleu-norisori-088,Invitație botez ursuleț bleu cu norișori și fundă satin,"Invitație delicată pentru botez băiețel, realizată în nuanțe bleu pastel, cu ursuleț adormit pe norișori și fundă din satin. Printată pe carton premium, cu un design blând și elegant, ideal pentru un eveniment de suflet.",https://boundlesscollection.ro/p/invitatie-botez-ursulet-bleu-cu-norisori-si-funda-satin-invitati.html,https://boundlesscollection.ro/images/invitatii/invitatie-ursulet-bleu-norisori.jpg,6.99 RON,in stock,new,Boundless Collection,invitatie-ursulet-bleu-norisori-088,Arts & Entertainment > Party & Celebration > Invitations,invitatii
invitatie-pergament-printesa-bleu-091,Invitație pergament tematică prințesă bleu cu fundă satin,"Invitație tip pergament pentru botez sau aniversare, realizată în nuanțe bleu pastel, cu grafică de basm și ilustrații elegante. Rulată manual și prinsă cu o fundă delicată din satin, pe carton premium, pentru un aspect rafinat și de poveste.",https://boundlesscollection.ro/p/invitatie-pergament-tematica-printesa-bleu-cu-funda-satin-invitati.html,https://boundlesscollection.ro/images/invitatii/invitatie-pergament-printesa-bleu.jpg,4.00 RON,in stock,new,Boundless Collection,invitatie-pergament-printesa-bleu-091,Arts & Entertainment > Party & Celebration > Invitations,invitatii
invitatie-absolvire-bleu-pergament-092,Invitație pergament absolvire cu fundă satin,"Invitație pentru absolvire, cu design modern în nuanțe bleu marble și accente aurii fine, imprimată pe carton premium și finisată elegant. Poate fi oferită plată sau rulată tip pergament și legată cu o fundă din satin, pentru un aspect festiv și rafinat.",https://boundlesscollection.ro/p/invitatie-pergament-absolvire-cu-funda-satin-invitati.html,https://boundlesscollection.ro/images/invitatii/invitatie-absolvire-bleu-pergament.jpg,4.00 RON,in stock,new,Boundless Collection,invitatie-absolvire-bleu-pergament-092,Arts & Entertainment > Party & Celebration > Invitations,invitatii
invitatie-pergament-fundita-aurie-093,Invitație pergament cu fundă aurie,"Invitație tip pergament, realizată pe carton premium cu aspect elegant, rulată manual și legată cu o fundă aurie strălucitoare. Design rafinat, potrivit pentru evenimente speciale, cu un aer minimalist și luxos.",https://boundlesscollection.ro/p/invitatie-pergament-cu-funda-aurie-invitati.html,https://boundlesscollection.ro/images/invitatii/invitatie-pergament-fundita-aurie.jpg,4.50 RON,in stock,new,Boundless Collection,invitatie-pergament-fundita-aurie-093,Arts & Entertainment > Party & Celebration > Invitations,invitatii
aranjament-floral-premium-soia-vas-ceramic-roz-001,Aranjament floral premium cu lumanari din ceara de soia si vas ceramic,"Aranjament floral premium realizat manual, compus din peste 15 lumanari din ceara de soia in forme florale variate, completat cu flori uscate decorative si aranjat intr-un vas ceramic elegant. Fiecare piesa este creata cu atentie la detalii, oferind un impact vizual deosebit. Ideal ca si cadou de lux pentru doamne, profesoare sau decor primavaratic.",https://boundlesscollection.ro/p/aranjament-floral-premium-cu-lumanari-din-ceara-de-soia-si-vas-ceramic-aranjame.html,https://boundlesscollection.ro/images/aranjamente/aranjament-premium-soia-vas-ceramic-roz.png,199.00 RON,in stock,new,Boundless Collection,aranjament-floral-premium-soia-vas-ceramic-roz-001,Home & Garden > Decor > Floral Arrangements,aranjamente-florale
aranjament-floral-9-lalele-soia-roz-001,Aranjament floral cu 9 lumanari din ceara de soia – buchet de lalele roz si ivoire,"Aranjament floral realizat manual, tip buchet elegant, compus din 9 lumanari din ceara de soia sub forma de lalele, in nuante delicate de roz si ivoire. Ambalat in hartie decorativa premium si accesorizat cu funda satinata. Un cadou parfumat si rafinat, ideal pentru doamne, profesoare sau decor primavaratic.",https://boundlesscollection.ro/p/aranjament-floral-cu-9-lumanari-din-ceara-de-soia-buchet-de-lalele-roz-si-ivoire-aranjame.html,https://boundlesscollection.ro/images/aranjamente/aranjament-9-lalele-roz-ivoire.PNG,69.00 RON,in stock,new,Boundless Collection,aranjament-floral-9-lalele-soia-roz-001,Home & Garden > Decor > Floral Arrangements,aranjamente-florale
aranjament-pastel-011,Aranjament floral din lumanari parfumate pastel,"Lumanari din ceara de soia modelate flori, nuante roz pudrat/ivoire/piersica. Piesa de decor sau cadou elegant.",https://boundlesscollection.ro/p/aranjament-floral-din-lumanari-parfumate-pastel-aranjame.html,https://boundlesscollection.ro/images/aranjamente/aranjament-floral-lumanari-pastel.png,74.99 RON,in stock,new,Boundless Collection,aranjament-pastel-011,Home & Garden > Decor > Artificial Flora > Artificial Flower Arrangements,aranjamente-florale
aranjament-inima-roz-012,Aranjament floral cu inima si lumanari parfumate,"Lumanari din soia in nuante roz/alb, accente cu inima si flori uscate. Cadou elegant sau decor de interior.",https://boundlesscollection.ro/p/aranjament-floral-cu-inima-si-lumanari-parfumate-aranjame.html,https://boundlesscollection.ro/images/aranjamente/aranjament-floral-inima-roz.PNG,74.99 RON,in stock,new,Boundless Collection,aranjament-inima-roz-012,Home & Garden > Decor > Artificial Flora > Artificial Flower Arrangements,aranjamente-florale
aranjament-mov-alb-013,Aranjament floral cu lumanari mov si albe,"Lumanari de soia mov/alb/roz pal, stil rafinat. Potrivit pentru cadouri si ambient elegant acasa.",https://boundlesscollection.ro/p/aranjament-floral-cu-lumanari-mov-si-albe-aranjame.html,https://boundlesscollection.ro/images/aranjamente/aranjament-floral-mov-alb.png,225.00 RON,in stock,new,Boundless Collection,aranjament-mov-alb-013,Home & Garden > Decor > Artificial Flora > Artificial Flower Arrangements,aranjamente-florale
aranjament-roz-iepuras-014,Aranjament floral roz cu figurina si lumanari parfumate,"Compozitie premium din soia, nuante roz/alb/crem; figurina decorativa si flori sculptate. Cadou deosebit.",https://boundlesscollection.ro/p/aranjament-floral-roz-cu-figurina-si-lumanari-parfumate-aranjame.html,https://boundlesscollection.ro/images/aranjamente/aranjament-floral-roz-iepuras.png,235.00 RON,in stock,new,Boundless Collection,aranjament-roz-iepuras-014,Home & Garden > Decor > Artificial Flora > Artificial Flower Arrangements,aranjamente-florale
aranjament-bleu-cos-015,Aranjament bleu in cos impletit cu lumanari parfumate,"Lumanari din soia in flori alb-bleu, cos tip piatra (praf de marmura), accente puf. Decor curat, aroma delicata.",https://boundlesscollection.ro/p/aranjament-bleu-in-cos-impletit-cu-lumanari-parfumate-aranjame.html,https://boundlesscollection.ro/images/aranjamente/aranjament-floral-bleu.PNG,34.99 RON,in stock,new,Boundless Collection,aranjament-bleu-cos-015,Home & Garden > Decor > Artificial Flora > Artificial Flower Arrangements,aranjamente-florale
aranjament-iepuras-roz-016,Aranjament roz cu iepuras si lumanari parfumate,Lumanari din soia model flori + figurina iepuras; roz pudrat/alb. Decor de primavara sau cadou rafinat.,https://boundlesscollection.ro/p/aranjament-roz-cu-iepuras-si-lumanari-parfumate-aranjame.html,https://boundlesscollection.ro/images/aranjamente/aranjament-floral-iepuras-roz.PNG,65.00 RON,in stock,new,Boundless Collection,aranjament-iepuras-roz-016,Home & Garden > Decor > Artificial Flora > Artificial Flower Arrangements,aranjamente-florale
aranjament-creioane-toamna-018,Aranjament cu lumanari parfumate in suport din creioane,"Lumanari din soia in flori pastel, suport creativ din creioane; flori uscate, pampas, fundita satin. Cadou profesor/office.",https://boundlesscollection.ro/p/aranjament-cu-lumanari-parfumate-in-suport-din-creioane-aranjame.html,https://boundlesscollection.ro/images/aranjamente/aranjament-floral-creioane-colorate.PNG,150.00 RON,in stock,new,Boundless Collection,aranjament-creioane-toamna-018,Home & Garden > Decor > Artificial Flora > Artificial Flower Arrangements,aranjamente-florale
marturie-iepuras-roz-048,Marturie iepuras roz in saculet tulle,"Marturie in forma de iepuras, turnata manual din ceara de soia si asezata in saculet de tulle cu fundita satin. Include eticheta personalizata si este ideala pentru botezuri si evenimente delicate.",https://boundlesscollection.ro/p/marturie-iepuras-roz-in-saculet-tulle-marturie.html,https://boundlesscollection.ro/images/marturii/marturie-iepuras-roz.jpg,30.00 RON,in stock,new,Boundless Collection,marturie-iepuras-roz-048,Arts & Entertainment > Party & Celebration > Favors,marturii soia
marturie-macaron-roz-055,Marturie macaron roz in cutie kraft,"Marturie tip macaron, realizata manual din ceara de soia si ambalata in cutie kraft cu fereastra. Decorul cu panglica si flori uscate plus eticheta personalizata o fac perfecta pentru botez sau petreceri elegante.",https://boundlesscollection.ro/p/marturie-macaron-roz-in-cutie-kraft-marturie.html,https://boundlesscollection.ro/images/marturii/marturie-macaron-roz.jpg,20.00 RON,in stock,new,Boundless Collection,marturie-macaron-roz-055,Arts & Entertainment > Party & Celebration > Favors,marturii soia
marturie-borcan-bujor-057,Marturie in borcan de sticla cu bujor roz,"Marturie din ceara de soia turnata in borcan de sticla, decorata cu bujor si ambalata elegant in cutie transparenta. Eticheta se personalizeaza cu nume si data, fiind potrivita pentru nunta, botez sau aniversari.",https://boundlesscollection.ro/p/marturie-in-borcan-de-sticla-cu-bujor-roz-marturie.html,https://boundlesscollection.ro/images/marturii/marturie-borcan-bujor-roz.jpg,25.00 RON,in stock,new,Boundless Collection,marturie-borcan-bujor-057,Arts & Entertainment > Party & Celebration > Favors,marturii soia
marturie-cuplu-imbratisat-roz-001,Marturie nunta cuplu imbratisat roz pudrat,"Marturie pentru nunta in forma de cuplu imbratisat, lucrata manual din ceara de soia cu finisaj mat si linii fine. O amintire romantica pentru invitati, potrivita pentru decoruri minimaliste.",https://boundlesscollection.ro/p/marturie-nunta-cuplu-imbratisat-roz-pudrat-marturie.html,https://boundlesscollection.ro/images/marturii/marturie-cuplu-imbratisat-roz.jpg,30.00 RON,in stock,new,Boundless Collection,marturie-cuplu-imbratisat-roz-001,Arts & Entertainment > Party & Celebration > Favors,marturii soia
marturie-ursulet-maro-001,Marturie ursulet maro din ceara de soia,"Marturie in forma de ursulet sezand, realizata manual din ceara de soia si finisata atent pentru un aspect premium. Ideala la botez, aniversare sau nunta cu tematica cozy, iar la comanda se poate personaliza.",https://boundlesscollection.ro/p/marturie-ursulet-maro-din-ceara-de-soia-marturie.html,https://boundlesscollection.ro/images/marturii/marturie-ursulet-maro.jpg,14.99 RON,in stock,new,Boundless Collection,marturie-ursulet-maro-001,Arts & Entertainment > Party & Celebration > Favors,marturii soia
marturie-iepuras-inima-maro-002,Marturie iepuras cu inimioara din ceara de soia,"Marturie iepuras cu urechi lungi si inimioara formata din labute, turnata manual din ceara de soia. Un cadou dulce pentru botezuri sau petreceri de copii, cu eticheta si ambalare personalizabile.",https://boundlesscollection.ro/p/marturie-iepuras-cu-inimioara-din-ceara-de-soia-marturie.html,https://boundlesscollection.ro/images/marturii/marturie-iepuras-inima-maro.jpg,30.00 RON,in stock,new,Boundless Collection,marturie-iepuras-inima-maro-002,Arts & Entertainment > Party & Celebration > Favors,marturii soia
marturie-ursulet-inimioare-roz-003,Marturie ursulet cu inimioare roz din ceara de soia,"Marturie ursulet din ceara de soia in nuanta ivory, cu inimioare roz discrete si detalii pictate fin. Potrivita pentru botez sau aniversari de copii, oferind invitatilor o amintire adorabila.",https://boundlesscollection.ro/p/marturie-ursulet-cu-inimioare-roz-din-ceara-de-soia-marturie.html,https://boundlesscollection.ro/images/marturii/marturie-ursulet-inimioare-roz.jpg,30.00 RON,in stock,new,Boundless Collection,marturie-ursulet-inimioare-roz-003,Arts & Entertainment > Party & Celebration > Favors,marturii soia
marturie-ursulet-inima-roz-004,Marturie ursulet cu inimioara roz din ceara de soia,"Marturie din ceara de soia cu ursulet asezat ce tine o inimioara roz in relief, cu accente fine si finisaj catifelat. Ideala ca marturie la botez, baby shower sau aniversare, cu eticheta personalizata.",https://boundlesscollection.ro/p/marturie-ursulet-cu-inimioara-roz-din-ceara-de-soia-marturie.html,https://boundlesscollection.ro/images/marturii/marturie-ursulet-inima-roz.jpg,30.00 RON,in stock,new,Boundless Collection,marturie-ursulet-inima-roz-004,Arts & Entertainment > Party & Celebration > Favors,marturii soia
marturie-bubble-cube-alb-005,Marturie lumanare bubble cube alba din ceara de soia,"Marturie bubble cube minimalista, facuta manual din ceara de soia naturala, cu sfere rotunjite si ardere uniforma. Se potriveste la nunta, botez sau evenimente moderne, ca mic suvenir elegant.",https://boundlesscollection.ro/p/marturie-lumanare-bubble-cube-alba-din-ceara-de-soia-marturie.html,https://boundlesscollection.ro/images/marturii/marturie-bubble-cube-alb.jpg,15.00 RON,in stock,new,Boundless Collection,marturie-bubble-cube-alb-005,Arts & Entertainment > Party & Celebration > Favors,marturii soia
marturie-fluture-alb-006,Marturie lumanare fluture alba din ceara de soia,"Marturie fluture delicat, turnat manual din ceara de soia cu aripi in relief si doua fitiluri pentru efect decorativ. O alegere rafinata pentru botez, nunta sau aniversari, cu ambalare personalizabila.",https://boundlesscollection.ro/p/marturie-lumanare-fluture-alba-din-ceara-de-soia-marturie.html,https://boundlesscollection.ro/images/marturii/marturie-fluture-alb.jpg,19.99 RON,in stock,new,Boundless Collection,marturie-fluture-alb-006,Arts & Entertainment > Party & Celebration > Favors,marturii soia
marturie-bebelus-trandafir-rose-067,Marturie lumanare bebelus in trandafir din ceara de soia,"Marturie speciala cu bebelus in interiorul unui trandafir, realizata manual din ceara de soia si finisata elegant. Potrivita pentru botez sau baby shower, se livreaza cu eticheta si ambalaj personalizat.",https://boundlesscollection.ro/p/marturie-lumanare-bebelus-in-trandafir-din-ceara-de-soia-marturie.html,https://boundlesscollection.ro/images/marturii/marturie-bebelus-trandafir.jpg,35.00 RON,in stock,new,Boundless Collection,marturie-bebelus-trandafir-rose-067,Arts & Entertainment > Party & Celebration > Favors,marturii soia
marturie-iepuras-floricica-068,Marturie iepuras cu floricica din ceara de soia,"Marturie iepuras cu floricica, realizata manual din ceara de soia cu detalii pictate fin si finisaj delicat. Ideala pentru botez, aniversari sau tematica bunny/spring, cu eticheta personalizata inclusa.",https://boundlesscollection.ro/p/marturie-iepuras-cu-floricica-din-ceara-de-soia-marturie.html,https://boundlesscollection.ro/images/marturii/marturie-iepuras-floricica.jpg,30.00 RON,in stock,new,Boundless Collection,marturie-iepuras-floricica-068,Arts & Entertainment > Party & Celebration > Favors,marturii soia
marturie-fluture-roz-cutie-069,Marturie fluture roz in cutie cu eticheta personalizata,"Marturie fluture din ceara de soia, ambalata in cutie kraft cu capac transparent si decor cu flori uscate. Eticheta se personalizeaza cu nume si data, fiind potrivita pentru botez, nunta sau baby shower.",https://boundlesscollection.ro/p/marturie-fluture-roz-in-cutie-cu-eticheta-personalizata-marturie.html,https://boundlesscollection.ro/images/marturii/marturie-fluture-roz-cutie.jpg,16.99 RON,in stock,new,Boundless Collection,marturie-fluture-roz-cutie-069,Arts & Entertainment > Party & Celebration > Favors,marturii soia
marturie-margareta-bleu-cutie-070,Marturie margareta alb-bleu in cutie cu eticheta personalizata,"Marturie margareta din ceara de soia, in alb cu centru bleu, ambalata in cutie kraft cu manseta argintie. Decorul floral si eticheta personalizata o fac ideala pentru botezuri cu tematica bleu.",https://boundlesscollection.ro/p/marturie-margareta-alb-bleu-in-cutie-cu-eticheta-personalizata-marturie.html,https://boundlesscollection.ro/images/marturii/marturie-margareta-bleu-cutie.jpg,25.00 RON,in stock,new,Boundless Collection,marturie-margareta-bleu-cutie-070,Arts & Entertainment > Party & Celebration > Favors,marturii soia
