id,title,description,link,image_link,price,availability,condition,brand,mpn,google_product_category,product_type
lumanare-glob-mos-sanie-002,Lumanare Craciun glob cu Mos Craciun in sanie,"Lumanare decorativa de Craciun in forma de glob cu Mos Craciun in sanie si ren, cu detalii reliefate. Turnata manual din ceara de soia, aspect premium si tema clasica de sarbatori. Potrivita pentru decorul mesei sau cadou festiv. Culoarea si aroma pot fi personalizate.",https://boundlesscollection.ro/p/lumanare-craciun-glob-cu-mos-craciun-in-sanie-lumanare.html,https://boundlesscollection.ro/images/craciun/lumanare-glob-mos-sanie.jpg,55.00 RON,in stock,new,Boundless Collection,lumanare-glob-mos-sanie-002,Home & Garden > Decor > Candles,craciun
lumanare-rotunda-nasterea-domnului-003,Lumanare rotunda Nasterea Domnului,"Lumanare decorativa rotunda cu scena Nasterii Domnului in relief fin, pentru un Craciun cu semnificatie. Realizata manual din ceara de soia, cu suprafata mata si detalii sculptate. Ideala pentru decor traditional sau cadou cu mesaj. Culoarea si aroma se pot personaliza.",https://boundlesscollection.ro/p/lumanare-rotunda-nasterea-domnului-lumanare.html,https://boundlesscollection.ro/images/craciun/lumanare-rotunda-nasterea-domnului.jpg,40.00 RON,in stock,new,Boundless Collection,lumanare-rotunda-nasterea-domnului-003,Home & Garden > Decor > Candles,craciun
lumanare-cilindru-fulgi-craciun-051,Lumanare cilindru cu fulgi de zapada,"Lumanare cilindrica din ceara de soia, decorata cu fulgi de zapada in relief. Arde curat si uniform, perfecta pentru ambient de iarna. Disponibila si pe o marime mai mare.",https://boundlesscollection.ro/p/lumanare-cilindru-cu-fulgi-de-zapada-lumanare.html,https://boundlesscollection.ro/images/craciun/lumanare-cilindru-fulgi.jpg,38.00 RON,in stock,new,Boundless Collection,lumanare-cilindru-fulgi-craciun-051,Home & Garden > Decor > Candles,craciun
lumanare-casuta-home-craciun-052,Lumanare decorativa casuta HOME,"Lumanare decorativa din ceara de soia in forma de casuta cu text HOME in relief. Stil minimalist si cozy, ideala pentru decorul casei in sezonul rece sau ca dar de Craciun.",https://boundlesscollection.ro/p/lumanare-decorativa-casuta-home-lumanare.html,https://boundlesscollection.ro/images/craciun/lumanare-casuta-home.jpg,55.00 RON,in stock,new,Boundless Collection,lumanare-casuta-home-craciun-052,Home & Garden > Decor > Candles,craciun
lumanare-brad-straturi-craciun-001,Lumanare decorativa brad in straturi Craciun,"Lumanare decorativa turnata manual din ceara de soia, model brad cu straturi ondulate si textura eleganta. Este disponibila si intr-o marime mai mica.",https://boundlesscollection.ro/p/lumanare-decorativa-brad-in-straturi-craciun-lumanare.html,https://boundlesscollection.ro/images/craciun/lumanare-brad-straturi-craciun.jpg,35.00 RON,in stock,new,Boundless Collection,lumanare-brad-straturi-craciun-001,Home & Garden > Decor > Candles,craciun
lumanare-brad-stativ-craciun-053,Lumanare decorativa brad Craciun model cu suport,"Lumanare decorativa turnata manual din ceara de soia, in forma de brad cu straturi si suport. Aspect minimalist si elegant, perfecta pentru decorul de sarbatori sau cadou festiv.",https://boundlesscollection.ro/p/lumanare-decorativa-brad-craciun-model-cu-suport-lumanare.html,https://boundlesscollection.ro/images/craciun/lumanare-brad-suport.jpg,17.00 RON,in stock,new,Boundless Collection,lumanare-brad-stativ-craciun-053,Home & Garden > Decor > Candles,craciun
lumanare-brad-relief-craciun-004,Lumanare decorativa brad de Craciun in relief,"Lumanare decorativa din ceara de soia, model brad de Craciun cu straturi suprapuse si ramuri stilizate in relief fin. Turnata manual, cu finisaj mat si aspect elegant. Ideala pentru decorul de iarna, aranjamente festive sau cadouri de sarbatori. Este disponibila si in varianta mai mica.",https://boundlesscollection.ro/p/lumanare-decorativa-brad-de-craciun-in-relief-lumanare.html,https://boundlesscollection.ro/images/craciun/lumanare-brad-relief.jpg,35.00 RON,in stock,new,Boundless Collection,lumanare-brad-relief-craciun-004,Home & Garden > Decor > Candles,craciun
lumanare-brad-bule-craciun-060,Lumanare decorativa brad din bule Craciun,"Lumanare decorativa din ceara de soia in forma de brad din bule, cu steluta in varf. Turnata manual, cu aspect modern si festiv, perfecta pentru decorul mesei sau cadou de sarbatori.",https://boundlesscollection.ro/p/lumanare-decorativa-brad-din-bule-craciun-lumanare.html,https://boundlesscollection.ro/images/craciun/lumanare-brad-bule-steluta-craciun.jpg,32.00 RON,in stock,new,Boundless Collection,lumanare-brad-bule-craciun-060,Home & Garden > Decor > Candles,craciun
lumanare-glob-spiralat-craciun-053,Lumanare decorativa glob spiralat Craciun,"Lumanare decorativa din ceara de soia in forma de glob de Craciun cu striatii spiralate. Aspect elegant, ideala pentru decor festiv sau cadou de sezon.",https://boundlesscollection.ro/p/lumanare-decorativa-glob-spiralat-craciun-lumanare.html,https://boundlesscollection.ro/images/craciun/glob-spiralat-craciun.jpg,45.00 RON,in stock,new,Boundless Collection,lumanare-glob-spiralat-craciun-053,Home & Garden > Decor > Candles,craciun
lumanare-glob-arabesque-craciun-001,Lumanare Craciun glob decorativ cu model arabesque,"Lumanare decorativa de Craciun in forma de glob, cu model arabesque in relief fin. Turnata manual din ceara de soia, cu finisaj mat si detalii elegante. Ideala ca piesa de decor pe masa de sarbatori sau cadou festiv.",https://boundlesscollection.ro/p/lumanare-craciun-glob-decorativ-cu-model-arabesque-lumanare.html,https://boundlesscollection.ro/images/craciun/lumanare-glob-arabesque.jpg,45.00 RON,in stock,new,Boundless Collection,lumanare-glob-arabesque-craciun-001,Home & Garden > Decor > Candles,craciun
lumanare-masinuta-craciun-040,Lumanare decorativa masinuta Craciun,"Lumanare decorativa masinuta Craciun din ceara de soia. Masinuta stil van retro, turnata manual din ceara de soia, perfecta ca piesa centrala in decorul de sarbatori. O lumanare statement care transforma orice colt intr-un decor de poveste de iarna.",https://boundlesscollection.ro/p/lumanare-decorativa-masinuta-craciun-lumanare.html,https://boundlesscollection.ro/images/craciun/lumanare-masinuta-craciun.jpg,35.00 RON,in stock,new,Boundless Collection,lumanare-masinuta-craciun-040,Home & Garden > Decor > Candles,craciun
lumanare-fulg-craciun-041,Lumanare decorativa fulg de zapada Craciun,"Lumanare decorativa din ceara de soia in forma de fulg de zapada, realizata manual. O piesa eleganta si festiva, perfecta pentru decorul de iarna sau cadouri de sezon.",https://boundlesscollection.ro/p/lumanare-decorativa-fulg-de-zapada-craciun-lumanare.html,https://boundlesscollection.ro/images/craciun/lumanare-fulg-craciun.jpg,25.00 RON,in stock,new,Boundless Collection,lumanare-fulg-craciun-041,Home & Garden > Decor > Candles,craciun
lumanare-manusa-craciun-042,Lumanare decorativa manusa Craciun,"Lumanare decorativa din ceara de soia in forma de manusa de iarna, turnata manual cu detalii fine tip tricot. Un decor cald si festiv, perfect pentru iarna si cadouri de sezon.",https://boundlesscollection.ro/p/lumanare-decorativa-manusa-craciun-lumanare.html,https://boundlesscollection.ro/images/craciun/lumanare-manusa-craciun.jpg,32.00 RON,in stock,new,Boundless Collection,lumanare-manusa-craciun-042,Home & Garden > Decor > Candles,craciun
lumanare-brad-flat-craciun-043,Lumanare decorativa brad de Craciun flat,"Lumanare decorativa din ceara de soia in forma de brad stilizat, turnata manual si decorata cu fundita aurie. Un element festiv perfect pentru decoruri de iarna sau cadouri de sezon.",https://boundlesscollection.ro/p/lumanare-decorativa-brad-de-craciun-flat-lumanare.html,https://boundlesscollection.ro/images/craciun/lumanare-brad-flat-craciun.jpg,25.00 RON,in stock,new,Boundless Collection,lumanare-brad-flat-craciun-043,Home & Garden > Decor > Candles,craciun
lumanare-brad-craciun-025,Lumanare parfumata brad de Craciun,"Lumanare parfumata turnata manual din ceara de soia, in forma de brad de Craciun, cu detalii in relief (brazi, ren, fulgi de zapada). Ideala pentru decorul de iarna sau cadouri festive. Pretul este pentru 1 bucata, fara aroma, iar culoarea si aroma pot fi personalizate.",https://boundlesscollection.ro/p/lumanare-parfumata-brad-de-craciun-lumanare.html,https://boundlesscollection.ro/images/craciun/lumanare-brad-craciun.jpg,35.00 RON,in stock,new,Boundless Collection,lumanare-brad-craciun-025,Home & Garden > Decor > Candles,craciun
lumanare-gnom-bradut-026,Lumanare gnom Craciun cu funda aurie si bradut,"Lumanare decorativa in forma de gnom, turnata manual din ceara de soia, cu funda aurie si bradut. Ideala pentru decorul de iarna sau cadouri de Craciun. Pretul este pentru 1 bucata, fara aroma; culoarea si aroma pot fi personalizate la comandă.",https://boundlesscollection.ro/p/lumanare-gnom-craciun-cu-funda-aurie-si-bradut-lumanare.html,https://boundlesscollection.ro/images/craciun/lumanare-gnom-bradut.jpg,25.00 RON,in stock,new,Boundless Collection,lumanare-gnom-bradut-026,Home & Garden > Decor > Candles,craciun
lumanare-brad-fulgi-029,Lumanare brad Craciun,"Lumanare decorativa turnata manual din ceara de soia, model brad cu textura tip frunza. Decorata cu funda argintie si colpotel auriu. Ideala pentru decorul de sarbatori sau cadouri de Craciun. Pretul este pentru 1 bucata, fara aroma; culoarea si aroma pot fi personalizate.",https://boundlesscollection.ro/p/lumanare-brad-craciun-lumanare.html,https://boundlesscollection.ro/images/craciun/lumanare-brad-fulgi.jpg,20.00 RON,in stock,new,Boundless Collection,lumanare-brad-fulgi-029,Home & Garden > Decor > Candles,craciun
lumanare-om-zapada-craciun-044,Lumanare decorativa om de zapada Craciun,"Lumanare decorativa din ceara de soia in forma de om de zapada, cu detalii fine tip tricot si fular de iarna. Un decor adorabil si festiv, perfect pentru cadouri si atmosfera de sarbatori.",https://boundlesscollection.ro/p/lumanare-decorativa-om-de-zapada-craciun-lumanare.html,https://boundlesscollection.ro/images/craciun/lumanare-om-zapada-craciun.jpg,25.00 RON,in stock,new,Boundless Collection,lumanare-om-zapada-craciun-044,Home & Garden > Decor > Candles,craciun
lumanare-gnom-fulg-auriu-045,Lumanare decorativa gnom cu fulg auriu,"Lumanare decorativa din ceara de soia in forma de gnom de Craciun, cu nas rosu si fulg auriu aplicat manual. O piesa festiva si adorabila, perfecta pentru decoruri de iarna sau cadouri speciale.",https://boundlesscollection.ro/p/lumanare-decorativa-gnom-cu-fulg-auriu-lumanare.html,https://boundlesscollection.ro/images/craciun/lumanare-gnom-fulg-auriu.jpg,25.00 RON,in stock,new,Boundless Collection,lumanare-gnom-fulg-auriu-045,Home & Garden > Decor > Candles,craciun
lumanare-ren-auriu-046,Lumanare decorativa ren cu funda aurie,"Lumanare decorativa din ceara de soia in forma de ren, impodobit cu funda aurie si clopotel. Un decor elegant si festiv, perfect pentru aranjamente de Craciun sau cadouri de sezon.",https://boundlesscollection.ro/p/lumanare-decorativa-ren-cu-funda-aurie-lumanare.html,https://boundlesscollection.ro/images/craciun/lumanare-ren-auriu.jpg,25.00 RON,in stock,new,Boundless Collection,lumanare-ren-auriu-046,Home & Garden > Decor > Candles,craciun
lumanare-gnom-fulg-argintiu-047,Lumanare decorativa gnom cu fulg argintiu,"Lumanare decorativa din ceara de soia in forma de gnom de Craciun, cu palarie inalta decorata cu fulg argintiu si nas rosu. Un decor festiv si elegant, ideal pentru cadouri si aranjamente de sezon.",https://boundlesscollection.ro/p/lumanare-decorativa-gnom-cu-fulg-argintiu-lumanare.html,https://boundlesscollection.ro/images/craciun/lumanare-gnom-fulg-argintiu.jpg,30.00 RON,in stock,new,Boundless Collection,lumanare-gnom-fulg-argintiu-047,Home & Garden > Decor > Candles,craciun
lumanare-gnom-fetita-028,Lumanare parfumata gnom fetita cu codite,"Lumanare turnata manual din ceara de soia, in forma de gnomita cu codite si palarie decorata cu fulgi argintii. Ideala pentru decorul de iarna sau cadouri festive. Pretul este pentru 1 bucata, fara aroma; culoarea si aroma pot fi personalizate.",https://boundlesscollection.ro/p/lumanare-parfumata-gnom-fetita-cu-codite-lumanare.html,https://boundlesscollection.ro/images/craciun/lumanare-gnom-fetita.jpg,30.00 RON,in stock,new,Boundless Collection,lumanare-gnom-fetita-028,Home & Garden > Decor > Candles,craciun
lumanare-gingerbread-om-turta-dulce-026,Lumanare omulet turta dulce Craciun,"Lumanare turnata manual din ceara de soia, in forma de omulet turta dulce. Detalii in relief, finisaj mat, perfecta pentru decorul de iarna sau cadouri festive. Culoarea si aroma pot fi personalizate.",https://boundlesscollection.ro/p/lumanare-omulet-turta-dulce-craciun-lumanare.html,https://boundlesscollection.ro/images/craciun/lumanare-omulet-turta-dulce.jpg,25.00 RON,in stock,new,Boundless Collection,lumanare-gingerbread-om-turta-dulce-026,Home & Garden > Decor > Candles,craciun
gnom-brad-cana-027,Lumanare gnom cu brad si cana Craciun,"Lumanare turnata manual din ceara de soia, model gnom de Craciun cu brad si cana in mana. Detalii fine, aspect decorativ elegant. Culoarea si aroma pot fi personalizate.",https://boundlesscollection.ro/p/lumanare-gnom-cu-brad-si-cana-craciun-gnom-bra.html,https://boundlesscollection.ro/images/craciun/lumanare-gnom-brad-cana.jpg,25.00 RON,in stock,new,Boundless Collection,gnom-brad-cana-027,Home & Garden > Decor > Candles,craciun
lumanare-con-brad-con-de-pin-030,Lumanare decorativa con de brad Craciun,"Lumanare decorativa turnata manual din ceara de soia, model con de brad cu textura realista. Accesorizata cu fundita aurie si clopotel metalic, perfecta pentru decorul de iarna, aranjamente festive si cadouri tematice.",https://boundlesscollection.ro/p/lumanare-decorativa-con-de-brad-craciun-lumanare.html,https://boundlesscollection.ro/images/craciun/lumanare-con-brad-con-de-pin.jpg,30.00 RON,in stock,new,Boundless Collection,lumanare-con-brad-con-de-pin-030,Home & Garden > Decor > Candles,craciun
lumanare-brad-nivele-031,Lumanare decorativa brad in straturi Craciun,"Lumanare decorativa turnata manual din ceara de soia, model brad cu straturi ondulate si detalii in relief. Accesorizata cu fundita aurie si clopotel metalic. Ideala pentru decorul de iarna, aranjamente de Craciun si cadouri festive.",https://boundlesscollection.ro/p/lumanare-decorativa-brad-in-straturi-craciun-lumanare.html,https://boundlesscollection.ro/images/craciun/lumanare-brad-nivele.jpg,30.00 RON,in stock,new,Boundless Collection,lumanare-brad-nivele-031,Home & Garden > Decor > Candles,craciun
lumanare-brad-bile-031,Lumanare decorativa brad din bile Craciun,"Lumanare decorativa turnata manual din ceara de soia, model brad format din bile sculptate tridimensional. Accesorizata cu fundita aurie si clopotel metalic. Piesa eleganta pentru decorul de iarna, aranjamente festive sau cadouri personalizate de Craciun. Pretul este pentru 1 bucata, fara aroma; culoarea si aroma pot fi personalizate.",https://boundlesscollection.ro/p/lumanare-decorativa-brad-din-bile-craciun-lumanare.html,https://boundlesscollection.ro/images/craciun/lumanare-brad-bile.jpg,32.00 RON,in stock,new,Boundless Collection,lumanare-brad-bile-031,Home & Garden > Decor > Candles,craciun
lumanare-fulg-turcoaz-craciun-002,Lumanare decorativa fulg de zapada turcoaz-alb Craciun,"Lumanare decorativa din ceara de soia in forma de fulg de zapada, in doua nuante (alb si turcoaz). Realizata manual, cu detalii fine in relief si finisaj mat. Perfecta pentru decorul de iarna, cadouri de sezon sau aranjamente festive.",https://boundlesscollection.ro/p/lumanare-decorativa-fulg-de-zapada-turcoaz-alb-craciun-lumanare.html,https://boundlesscollection.ro/images/craciun/lumanare-fulg-turcoaz.jpg,25.00 RON,in stock,new,Boundless Collection,lumanare-fulg-turcoaz-craciun-002,Home & Garden > Decor > Candles,craciun
lumanare-fulg-roz-craciun-003,Lumanare decorativa fulg de zapada roz-alb Craciun,"Lumanare decorativa din ceara de soia in forma de fulg de zapada, in doua nuante (alb si roz intens). Realizata manual, cu model decupat fin si aspect elegant, ideala pentru decoruri de iarna, cadouri festive sau aranjamente de Craciun.",https://boundlesscollection.ro/p/lumanare-decorativa-fulg-de-zapada-roz-alb-craciun-lumanare.html,https://boundlesscollection.ro/images/craciun/lumanare-fulg-roz.jpg,25.00 RON,in stock,new,Boundless Collection,lumanare-fulg-roz-craciun-003,Home & Garden > Decor > Candles,craciun
lumanare-fulg-rosu-craciun-004,Lumanare decorativa fulg de zapada rosu-alb Craciun,"Lumanare decorativa din ceara de soia in forma de fulg de zapada, bicolora (alb cu accente rosu intens pe laterale). Lucrata manual, cu detalii fine si aspect modern, perfecta pentru decor de iarna, aranjamente festive sau cadouri de Craciun.",https://boundlesscollection.ro/p/lumanare-decorativa-fulg-de-zapada-rosu-alb-craciun-lumanare.html,https://boundlesscollection.ro/images/craciun/lumanare-fulg-rosu.jpg,25.00 RON,in stock,new,Boundless Collection,lumanare-fulg-rosu-craciun-004,Home & Garden > Decor > Candles,craciun
lumanare-fulg-bleu-craciun-005,Lumanare decorativa fulg de zapada bleu-alb Craciun,"Lumanare decorativa din ceara de soia in forma de fulg de zapada, bicolora (alb cu accente bleu pe laterale). Realizata manual, cu detalii geometrice fine si aspect elegant de iarna. Ideala pentru decor festiv, aranjamente de Craciun sau cadou sezonier.",https://boundlesscollection.ro/p/lumanare-decorativa-fulg-de-zapada-bleu-alb-craciun-lumanare.html,https://boundlesscollection.ro/images/craciun/lumanare-fulg-bleu.jpg,25.00 RON,in stock,new,Boundless Collection,lumanare-fulg-bleu-craciun-005,Home & Garden > Decor > Candles,craciun
lumanare-fulg-verde-craciun-006,Lumanare decorativa fulg de zapada verde-alb Craciun,"Lumanare decorativa din ceara de soia in forma de fulg de zapada, bicolora (alb cu accente verde/turcoaz pe laterale). Turnata manual, cu model geometric bine definit si finisaj mat. Perfecta pentru decorul de iarna, aranjamente festive sau cadou de Craciun.",https://boundlesscollection.ro/p/lumanare-decorativa-fulg-de-zapada-verde-alb-craciun-lumanare.html,https://boundlesscollection.ro/images/craciun/lumanare-fulg-verde.jpg,25.00 RON,in stock,new,Boundless Collection,lumanare-fulg-verde-craciun-006,Home & Garden > Decor > Candles,craciun
numar-masa-ursulet-roz-001,Numar de masa botez cu ursulet roz personalizat,"Numar de masa pentru botez in nuante roz pastel, cu ilustratie ursulet si balon tip nor. Se personalizeaza cu numele copilului si numarul mesei, fiind ideal pentru organizarea invitatilor si decor unitar. Print pe carton premium, format tip suport/tent, potrivit pentru mese festive.",https://boundlesscollection.ro/p/numar-de-masa-botez-cu-ursulet-roz-personalizat-numar-ma.html,https://boundlesscollection.ro/images/numere/numar-masa-ursulet-roz.jpg,7.00 RON,in stock,new,Boundless Collection,numar-masa-ursulet-roz-001,Arts & Entertainment > Party & Celebration > Party Supplies,numere de masa
cani-0001,Cana personalizata din sticla cu nume auriu,"Cana eleganta din sticla, personalizata cu nume in vinil auriu. Potrivita pentru nunti, botezuri sau cadouri speciale. Personalizarea se face la cerere cu nume/mesaj si font la alegere.",https://boundlesscollection.ro/p/cana-personalizata-din-sticla-cu-nume-auriu-cani-000.html,https://boundlesscollection.ro/images/cani/cana-perso-02.png,30.00 RON,in stock,new,Boundless Collection,cani-0001,Home & Garden > Kitchen & Dining > Tableware > Drinkware > Mugs,cani personalizate
ev-0001,Evantai personalizat inimioara – Botez / Nunta,"Evantai personalizat pentru evenimente, cu forma inimioara si maner din lemn. Se poate personaliza cu nume, data si tematica evenimentului.",https://boundlesscollection.ro/p/evantai-personalizat-inimioara-botez-nunta-ev-0001.html,https://boundlesscollection.ro/images/evantaie/ev-0001.png,6.00 RON,in stock,new,Boundless Collection,ev-0001,Arts & Entertainment > Hobbies & Creative Arts > Party Supplies > Hand Fans,evantaie
tablou-toy-shop-luminos-001,Tablou luminos din carton cu luminite – Toy Shop,"Tablou tip shadow box din carton decupat in straturi, cu luminite LED calde integrate. Realizat manual, ideal pentru decor de iarna sau cadou special.",https://boundlesscollection.ro/p/tablou-luminos-din-carton-cu-luminite-toy-shop-tablou-t.html,https://boundlesscollection.ro/images/tablouri/tablou-toy-shop-1.jpg,100.00 RON,in stock,new,Boundless Collection,tablou-toy-shop-luminos-001,Home & Garden > Decor > Wall Decor > Wall Art,tablouri luminoase
topper-tort-set-its-a-girl-boy-001,Set toppere tort It’s a Girl / It’s a Boy (baby shower / botez),"Set toppere pentru tort realizate din carton printat, cu mesaje It’s a Girl si It’s a Boy, in nuante roz si bleu, cu simbol talpite. Ideal pentru baby shower, botez sau gender reveal. Se poate personaliza la cerere cu nume, data sau cromatica.",https://boundlesscollection.ro/p/set-toppere-tort-its-a-girl-its-a-boy-baby-shower-botez-topper-t.html,https://boundlesscollection.ro/images/toppere/toppere-its-a-girl-boy.jpg,10.00 RON,in stock,new,Boundless Collection,topper-tort-set-its-a-girl-boy-001,Arts & Entertainment > Party & Celebration > Party Supplies > Cake Toppers,toppere tort
martisor-margareta-verde-carton-001,Martisor Margareta alba cu centru verde pe carton,"Martisor realizat manual din ceara de soia, sub forma de margareta alba cu centru verde lime, asezata pe carton decorativ ilustrat.",https://boundlesscollection.ro/p/martisor-margareta-alba-cu-centru-verde-pe-carton-martisor.html,https://boundlesscollection.ro/images/martisor/martisor-margareta-verde-carton.png,15.99 RON,in stock,new,Boundless Collection,martisor-margareta-verde-carton-001,Home & Garden > Decor > Decorative Objects,martisor
martisor-margareta-portocaliu-carton-001,Martisor Margareta cu centru portocaliu pe carton,"Martisor realizat manual din ceara de soia, sub forma de margareta alba cu centru portocaliu, montata pe carton decorativ cu ilustratie de primavara si mesaj tematic.",https://boundlesscollection.ro/p/martisor-margareta-cu-centru-portocaliu-pe-carton-martisor.html,https://boundlesscollection.ro/images/martisor/margareta-portocaliu-carton.png,15.99 RON,in stock,new,Boundless Collection,martisor-margareta-portocaliu-carton-001,Home & Garden > Decor > Decorative Objects,martisor
martisor-margareta-alb-mov-carton-001,Martisor Margareta alb cu centru mov pe carton,"Martisor handmade din ceara de soia, sub forma de margareta alba cu centru mov, montata pe carton decorativ cu tematica de primavara si ambalata individual.",https://boundlesscollection.ro/p/martisor-margareta-alb-cu-centru-mov-pe-carton-martisor.html,https://boundlesscollection.ro/images/martisor/margareta-alb-mov-carton.png,15.99 RON,in stock,new,Boundless Collection,martisor-margareta-alb-mov-carton-001,Home & Garden > Decor > Decorative Objects,martisor
martisor-margareta-galben-carton-001,Martisor Margareta cu centru galben pe carton,"Martisor handmade cu lumanare decorativa din ceara, sub forma de margareta cu centru galben, asezata pe carton ilustrat cu tematica de primavara si ambalata individual in punga transparenta cu margarete.",https://boundlesscollection.ro/p/martisor-margareta-cu-centru-galben-pe-carton-martisor.html,https://boundlesscollection.ro/images/martisor/margareta-galben-carton.png,15.99 RON,in stock,new,Boundless Collection,martisor-margareta-galben-carton-001,Home & Garden > Decor > Decorative Objects,martisor
martisor-margareta-albastra-carton-001,Martisor Margareta albastra pe carton,"Martisor handmade sub forma de margareta cu petale ivoire si centru albastru, realizat din ceara, montat pe carton decorativ cu mesaj de primavara si ambalat individual in folie transparenta cu margarete.",https://boundlesscollection.ro/p/martisor-margareta-albastra-pe-carton-martisor.html,https://boundlesscollection.ro/images/martisor/margareta-albastra-carton.png,15.99 RON,in stock,new,Boundless Collection,martisor-margareta-albastra-carton-001,Home & Garden > Decor > Decorative Objects,martisor
martisor-margareta-maro-carton-001,Martisor Margareta maro pe carton,"Martisor handmade din ceara de soia, sub forma de margareta cu petale ivoire si centru maro, montata pe carton decorativ cu mesaj de primavara si ambalata individual.",https://boundlesscollection.ro/p/martisor-margareta-maro-pe-carton-martisor.html,https://boundlesscollection.ro/images/martisor/margareta-maro-carton.png,15.99 RON,in stock,new,Boundless Collection,martisor-margareta-maro-carton-001,Home & Garden > Decor > Decorative Objects,martisor
martisor-margareta-mov-001,Martisor Margareta mov,"Martisor realizat manual din ceara de soia, sub forma de margareta cu centru mov, ambalat intr-o cutie alba eleganta cu fereastra si decorat cu funda satinata mov. Un cadou delicat pentru inceputul primaverii.",https://boundlesscollection.ro/p/martisor-margareta-mov-martisor.html,https://boundlesscollection.ro/images/martisor/margareta-mov-alb.jpg,15.99 RON,in stock,new,Boundless Collection,martisor-margareta-mov-001,Home & Garden > Decor > Decorative Objects,martisor
martisor-margareta-aurie-alb-001,Martisor Margareta aurie,"Martisor handmade din ceara de soia, sub forma de margareta cu centru galben, ambalat intr-o cutie alba cu fereastra si funda satinata aurie. Cadou luminos si elegant de Martisor.",https://boundlesscollection.ro/p/martisor-margareta-aurie-martisor.html,https://boundlesscollection.ro/images/martisor/margareta-aurie-alb.jpg,15.99 RON,in stock,new,Boundless Collection,martisor-margareta-aurie-alb-001,Home & Garden > Decor > Decorative Objects,martisor
