id,title,description,link,image_link,price,availability,condition,brand,mpn,google_product_category,product_type
plic-dar-verighete-multumire-001,Plic de dar cu verighete si mesaj multumim,"Plic de dar pentru nunta, cu verighete aurii si design floral pastel, plus mesaj „Multumim!”. Printat pe carton premium mat, cu spatiu pentru nume familie, ideal pentru masa de dar.",https://boundlesscollection.ro/p/plic-de-dar-cu-verighete-si-mesaj-multumim-plic-dar.html,https://boundlesscollection.ro/images/plicuri/plic-dar-verighete-multumim.jpg,3.00 RON,in stock,new,Boundless Collection,plic-dar-verighete-multumire-001,Arts & Entertainment > Party & Celebration > Gift Giving > Money Envelopes,plicuri
plic-botez-bleu-ursulet-024,Plic botez bleu cu ursulet si Mickey,"Plic de dar bleu pentru botez, cu ursulet si Mickey in stil jucaus, pe carton mat premium. Are text si zona pentru nume familie/copil, personalizabile pentru tematica evenimentului.",https://boundlesscollection.ro/p/plic-botez-bleu-cu-ursulet-si-mickey-plic-bot.html,https://boundlesscollection.ro/images/plicuri/plic-botez-bleu-ursulet.jpg,3.00 RON,in stock,new,Boundless Collection,plic-botez-bleu-ursulet-024,Arts & Entertainment > Party & Celebration > Gift Giving > Money Envelopes,plicuri
set-invitatie-plic-boho-018,Set invitatie + plic de dar boho natur,"Set coordonat pe carton texturat: invitatie + plic de dar; sigiliu auriu, flori uscate, sfoara subtire. Personalizabil.",https://boundlesscollection.ro/p/set-invitatie-plic-de-dar-boho-natur-set-invi.html,https://boundlesscollection.ro/images/seturi/set-invitatie-plic-boho-natur.jpg,17.00 RON,in stock,new,Boundless Collection,set-invitatie-plic-boho-018,Arts & Entertainment > Party & Celebration > Invitations,set
plic-dar-carusel-vintage-085,Plic de dar botez carusel vintage bej,"Plic de dar elegant pentru botez sau petrecere de copii, cu ilustratie tip carusel in stil vintage, in nuante calde bej-ivory. Printat pe carton premium mat, cu mesaj de multumire si spatiu pentru numele familiei. Se personalizeaza cu nume, data si text la alegere, fiind perfect pentru o masa de dar unitara si rafinata.",https://boundlesscollection.ro/p/plic-de-dar-botez-carusel-vintage-bej-plic-dar.html,https://boundlesscollection.ro/images/plicuri/plic-dar-carusel-vintage.jpg,3.00 RON,in stock,new,Boundless Collection,plic-dar-carusel-vintage-085,Arts & Entertainment > Party & Celebration > Gift Giving > Money Envelopes,plicuri
plic-dar-iepuras-baloane-roz-085,Plic de dar iepuras cu baloane roz pastel,"Plic de dar delicat pentru botez sau aniversare, cu ilustratie de iepuras si baloane in nuante roz pastel. Printat pe carton premium alb, cu mesaj de multumire si spatiu pentru completarea numelui familiei. Ideal pentru masa de dar si pentru tematici baby girl, cu posibilitate de personalizare la cerere.",https://boundlesscollection.ro/p/plic-de-dar-iepuras-cu-baloane-roz-pastel-plic-dar.html,https://boundlesscollection.ro/images/plicuri/plic-dar-iepuras-baloane-roz.jpg,3.00 RON,in stock,new,Boundless Collection,plic-dar-iepuras-baloane-roz-085,Arts & Entertainment > Party & Celebration > Gift Giving > Money Envelopes,plicuri
plic-dar-elefantel-bleu-bine-ati-venit-086,Plic de dar elefantel bleu cu balon – mesaj bine ati venit,"Plic de dar pentru botez sau prima aniversare, cu tematica baby boy si ilustratie simpatica de elefantel bleu cu balon. Designul include mesaj de intampinare „Bine ati venit!” si spatiu pentru completarea numelui familiei, fiind perfect pentru masa de dar si un decor unitar la eveniment.",https://boundlesscollection.ro/p/plic-de-dar-elefantel-bleu-cu-balon-mesaj-bine-ati-venit-plic-dar.html,https://boundlesscollection.ro/images/plicuri/plic-dar-elefantel-bleu-bine-ati-venit.jpg,3.00 RON,in stock,new,Boundless Collection,plic-dar-elefantel-bleu-bine-ati-venit-086,Arts & Entertainment > Party & Celebration > Gift Giving > Money Envelopes,plicuri
plic-dar-floral-roz-099,Plic de dar floral roz pastel,"Plic de dar elegant, cu grafica florala in nuante roz pastel si accente fine, potrivit pentru nunta, botez sau aniversari. Este printat pe carton premium mat, cu spatiu dedicat pentru numele familiei si mesaj de multumire, pentru un decor unitar si rafinat la masa de dar.",https://boundlesscollection.ro/p/plic-de-dar-floral-roz-pastel-plic-dar.html,https://boundlesscollection.ro/images/plicuri/plic-dar-floral-roz-1.jpg,3.00 RON,in stock,new,Boundless Collection,plic-dar-floral-roz-099,Arts & Entertainment > Party & Celebration > Gift Giving > Money Envelopes,plicuri
plic-dar-ursulet-balerina-roz-100,Plic de dar ursulet balerina roz pastel,"Plic de dar delicat, in nuante roz pastel, cu ilustratie ursulet balerina si baloane fine. Printat pe carton premium mat, cu spatiu pentru numele familiei si mesaj de multumire, ideal pentru botezuri, aniversari sau evenimente cu tematica baby girl. Completeaza armonios decorul mesei de dar si restul papetariei din colectie.",https://boundlesscollection.ro/p/plic-de-dar-ursulet-balerina-roz-pastel-plic-dar.html,https://boundlesscollection.ro/images/plicuri/plic-dar-ursulet-balerina-roz.jpg,3.00 RON,in stock,new,Boundless Collection,plic-dar-ursulet-balerina-roz-100,Arts & Entertainment > Party & Celebration > Gift Giving > Money Envelopes,plicuri
meniu-balerina-roz-089,Meniu botez balerina roz carte,"Meniu de botez tip carte, in nuante roz pastel, cu ilustratie balerina si accente delicate. Printat pe carton premium si personalizabil complet cu preparate, nume si data",https://boundlesscollection.ro/p/meniu-botez-balerina-roz-carte-meniu-ba.html,https://boundlesscollection.ro/images/meniuri/meniu-balerina-roz.jpg,6.00 RON,in stock,new,Boundless Collection,meniu-balerina-roz-089,Arts & Entertainment > Party & Celebration > Party Supplies,meniuri
meniu-botez-elefantel-bleu-053,Meniu botez elefantel bleu,"Meniu pentru botez in nuante bleu pastel, cu elefantel si baloane, printat pe carton premium. Se personalizeaza integral cu preparatele si detaliile evenimentului, oferind mesei un look baby boy elegant si unitar.",https://boundlesscollection.ro/p/meniu-botez-elefantel-bleu-meniu-bo.html,https://boundlesscollection.ro/images/meniuri/meniu-botez-elefant-bleu.jpg,6.00 RON,in stock,new,Boundless Collection,meniu-botez-elefantel-bleu-053,Arts & Entertainment > Party & Celebration > Party Supplies,meniuri
meniu-botez-safari-verde-054,Meniu botez Safari cu frunze verzi,"Meniu de botez cu tematica Safari, decorat cu animale de jungla si frunze tropicale, pliat tip carte. Print pe carton premium alb, cu personalizare completa a meniului, numelui si datei pentru un decor fresh si vesel.",https://boundlesscollection.ro/p/meniu-botez-safari-cu-frunze-verzi-meniu-bo.html,https://boundlesscollection.ro/images/meniuri/meniu-botez-safari-verde.jpg,6.00 RON,in stock,new,Boundless Collection,meniu-botez-safari-verde-054,Arts & Entertainment > Party & Celebration > Party Supplies,meniuri
meniu-botez-roz-sigiliu-049,Meniu botez roz cu sigiliu,"Meniu elegant pentru botez, printat pe carton premium si accesorizat cu sigiliu roz pudrat si flori uscate. Personalizabil cu preparatele si detaliile evenimentului, ideal pentru decoruri pastel si mese rafinate.",https://boundlesscollection.ro/p/meniu-botez-roz-cu-sigiliu-meniu-bo.html,https://boundlesscollection.ro/images/meniuri/meniu-botez-roz-sigiliu.jpg,7.00 RON,in stock,new,Boundless Collection,meniu-botez-roz-sigiliu-049,Arts & Entertainment > Party & Celebration > Party Supplies,meniuri
meniu-botez-baietel-veverite-021,Meniu botez baietel cu veverite,"Meniu personalizat pentru botez baietel, cu grafica veverite si ghinde in stil jucaus. Printat pe carton mat premium, pliat tip carte, iar textul se adapteaza complet meniului si tematicii evenimentului.",https://boundlesscollection.ro/p/meniu-botez-baietel-cu-veverite-meniu-bo.html,https://boundlesscollection.ro/images/meniuri/meniu-botez-baietel-veverite.jpg,6.00 RON,in stock,new,Boundless Collection,meniu-botez-baietel-veverite-021,Arts & Entertainment > Party & Celebration > Party Supplies,meniuri
marturie-lumanare-roz-022,Marturie lumanare roz pastel cu flori uscate,"Lumanare din soia roz pastel cu panglica satin, puf decorativ si eticheta personalizata. Potrivita pentru nunta/botez.",https://boundlesscollection.ro/p/marturie-lumanare-roz-pastel-cu-flori-uscate-marturie.html,https://boundlesscollection.ro/images/marturii/marturie-lumanare-roz.jpg,25.00 RON,in stock,new,Boundless Collection,marturie-lumanare-roz-022,Arts & Entertainment > Party & Celebration > Favors,marturii soia
set-meniu-plic-botez-safari-056,Set meniu + plic botez Safari,"Set coordonat pentru botez cu tematica Safari: meniu fata-verso pe carton premium, cu animale gingase de jungla si frunze tropicale, plus plic asortat pentru dar sau mesaj. Personalizare completa cu nume, data si detalii de eveniment, pentru un decor unitar.",https://boundlesscollection.ro/p/set-meniu-plic-botez-safari-set-meni.html,https://boundlesscollection.ro/images/seturi/set-meniu-plic-botez-safari.jpg,10.99 RON,in stock,new,Boundless Collection,set-meniu-plic-botez-safari-056,Arts & Entertainment > Party & Celebration > Invitations,set
set-invitatie-plic-botez-bleu-023,Set invitatie + plic botez bleu cu fundita si ursulet,"Set delicat pentru botez baietel: invitatie si plic asortat in bleu pastel, cu ursulet simpatic si fundita organza. Tiparit pe carton premium mat, cu grafica fina si text personalizabil integral (nume, data, locatie, mesaj).",https://boundlesscollection.ro/p/set-invitatie-plic-botez-bleu-cu-fundita-si-ursulet-set-invi.html,https://boundlesscollection.ro/images/seturi/set-invitatie-plic-botez-bleu.jpg,12.50 RON,in stock,new,Boundless Collection,set-invitatie-plic-botez-bleu-023,Arts & Entertainment > Party & Celebration > Invitations,set
set-invitatie-plic-ursulet-060,Set invitatie + plic de dar cu ursulet,"Set coordonat pentru botez, format din invitatie pe carton premium alb cu ilustratie ursulet pastel si plic de dar in acelasi design. Ambele piese se personalizeaza complet cu nume, data si textul dorit; invitatia se livreaza rulata sul, legata cu panglica satin.",https://boundlesscollection.ro/p/set-invitatie-plic-de-dar-cu-ursulet-set-invi.html,https://boundlesscollection.ro/images/seturi/set-invitatie-plic-ursulet.jpg,11.00 RON,in stock,new,Boundless Collection,set-invitatie-plic-ursulet-060,Arts & Entertainment > Party & Celebration > Invitations,set
set-invitatie-meniu-plic-lamai-063,Set invitatie + meniu + plic de dar cu lamai,"Set complet pentru nunta cu tematica mediteraneana: invitatie pe carton premium cu grafica lamai si flori albastre, meniu asortat si plic de dar in acelasi stil citrus. Personalizare integrala cu nume, data si text, ideal pentru evenimente de vara luminoase.",https://boundlesscollection.ro/p/set-invitatie-meniu-plic-de-dar-cu-lamai-set-invi.html,https://boundlesscollection.ro/images/seturi/set-invitatie-meniu-plic-lamai.jpg,21.00 RON,in stock,new,Boundless Collection,set-invitatie-meniu-plic-lamai-063,Arts & Entertainment > Party & Celebration > Invitations,set
sticker-oglinda-auriu-caligrafic-001,Sticker oglinda personalizat auriu (nume + data),"Autocolant caligrafic pentru oglinda de intampinare: nume mirii + data, vinil auriu lucios. Se livreaza gata de aplicat, cu folie de transfer. Dimensiuni si text personalizabile.",https://boundlesscollection.ro/p/sticker-oglinda-personalizat-auriu-nume-data-sticker-.html,https://boundlesscollection.ro/images/stickere/sticker-oglinda-auriu-mara-alexandru-2025.jpg,85.00 RON,in stock,new,Boundless Collection,sticker-oglinda-auriu-caligrafic-001,Home & Garden > Decor > Decals & Stickers,stickere oglinda
set-invitatie-meniu-plic-travel-085,Set invitatie + meniu + plic de dar Travel cu avion,"Set complet pentru nunta cu tematica travel: invitatie, meniu si plic de dar coordonate, cu grafica vintage inspirata din harti, pasapoarte si avion. Tiparit pe carton premium, cu layout elegant si detalii fine, ideal pentru evenimente cu vibe de calatorie. Textele se personalizeaza integral cu nume, data si mesajul dorit.",https://boundlesscollection.ro/p/set-invitatie-meniu-plic-de-dar-travel-cu-avion-set-invi.html,https://boundlesscollection.ro/images/seturi/set-invitatie-meniu-plic-travel.jpg,21.00 RON,in stock,new,Boundless Collection,set-invitatie-meniu-plic-travel-085,Arts & Entertainment > Party & Celebration > Invitations,set
set-invitatie-plicuri-meniu-elefant-086,Set invitatie + plic invitatie + plic de dar + meniu Elefant bleu,"Set complet pentru botez in nuante bleu, cu grafica delicata de elefantel si balonase: invitatie, plic pentru invitatie, plic de dar si meniu coordonate in acelasi stil. Tiparit pe carton premium, cu panglica satin pentru un plus de eleganta. Toate textele se personalizeaza integral cu nume, data si mesajul dorit, pentru o papetarie unitara la eveniment.",https://boundlesscollection.ro/p/set-invitatie-plic-invitatie-plic-de-dar-meniu-elefant-bleu-set-invi.html,https://boundlesscollection.ro/images/seturi/set-invitatie-plicuri-meniu-elefant-bleu.jpg,22.00 RON,in stock,new,Boundless Collection,set-invitatie-plicuri-meniu-elefant-086,Arts & Entertainment > Party & Celebration > Invitations,set
set-marturie-plic-dar-fluture-087,Set marturie + plic de dar Fluture roz floral,"Set coordonat pentru evenimente delicate, format din marturie parfumabila tip fluture din ceara de soia, prezentata pe card floral in ambalaj transparent, si plic de dar asortat in acelasi design romantic. Culorile, aroma si textele se personalizeaza cu nume si data, iar pentru protectia datelor, scrisul poate fi usor distorsionat in imaginile de prezentare. Un set fin si unitar pentru botez, nunta sau aniversari.",https://boundlesscollection.ro/p/set-marturie-plic-de-dar-fluture-roz-floral-set-mart.html,https://boundlesscollection.ro/images/seturi/set-marturie-plic-dar-fluture-roz-floral.jpg,15.00 RON,in stock,new,Boundless Collection,set-marturie-plic-dar-fluture-087,Arts & Entertainment > Party & Celebration > Invitations,set
set-meniu-invitatie-auriu-094,Set meniu + plic de dar tematica auriu,"Set coordonat de papetarie pentru nunta sau botez, cu meniu si plic de dar in acelasi stil elegant cu accente aurii si grafica fina. Printate pe carton premium, cu aspect luminos si rafinat, iar textul se personalizeaza integral pentru un rezultat unitar si memorabil.",https://boundlesscollection.ro/p/set-meniu-plic-de-dar-tematica-auriu-set-meni.html,https://boundlesscollection.ro/images/seturi/set-meniu-plic-auriu.jpg,14.00 RON,in stock,new,Boundless Collection,set-meniu-invitatie-auriu-094,Arts & Entertainment > Party & Celebration > Invitations,set
set-invitatie-pergament-plic-dar-bleu-095,Set invitatie pergament + plic de dar bleu cu fundita,"Set coordonat pentru botez sau nunta, format din invitatie tip pergament in nuante bleu pastel si plic de dar asortat, rulata sul si legata cu fundita satin. Grafica delicata si aerul romantic il fac ideal pentru evenimente elegante, iar textul se personalizeaza integral dupa preferinte.",https://boundlesscollection.ro/p/set-invitatie-pergament-plic-de-dar-bleu-cu-fundita-set-invi.html,https://boundlesscollection.ro/images/seturi/set-invitatie-pergament-plic-dar-bleu.jpg,12.00 RON,in stock,new,Boundless Collection,set-invitatie-pergament-plic-dar-bleu-095,Arts & Entertainment > Party & Celebration > Invitations,set
set-invitatie-carte-plic-dar-bleu-096,Set invitatie tip carte + plic de dar bleu,"Set coordonat pentru botez, format din invitatie tip carte in nuante bleu pastel, cu grafica jucausa si fundita satin, plus plic de dar asortat. Printate pe carton premium, ambele piese se personalizeaza complet cu nume, data si textul evenimentului, pentru un decor unitar si elegant.",https://boundlesscollection.ro/p/set-invitatie-tip-carte-plic-de-dar-bleu-set-invi.html,https://boundlesscollection.ro/images/seturi/set-invitatie-carte-plic-dar-bleu.jpg,10.50 RON,in stock,new,Boundless Collection,set-invitatie-carte-plic-dar-bleu-096,Arts & Entertainment > Party & Celebration > Invitations,set
set-marturie-invitatie-lamai-097,Set marturie + invitatie cu lamai,"Set coordonat cu tematica mediteraneana, format din marturie parfumata si invitatie asortata, decorate cu felii de lamai si accente galben-aurii. Realizate manual pe materiale premium, cu grafica fresca de vara; elementele se personalizeaza complet cu nume, data si textul evenimentului, pentru un look unitar si luminos.",https://boundlesscollection.ro/p/set-marturie-invitatie-cu-lamai-set-mart.html,https://boundlesscollection.ro/images/seturi/set-marturie-invitatie-lamai.jpg,29.00 RON,in stock,new,Boundless Collection,set-marturie-invitatie-lamai-097,Arts & Entertainment > Party & Celebration > Invitations,set
waxmelts-craciun-53g-001,Cutie Melt-Me Craciun 53g cu wax melts parfumate,"Cutie melt-me de Craciun cu aprox. 53g wax melts parfumate, turnate manual din ceara de soia 100% naturala. Figurine aromate in forme festive, ideale pentru arzator de esente si pentru o atmosfera cozy de sarbatori. Cadou perfect pentru Secret Santa sau pentru iubitorii de arome de iarna.",https://boundlesscollection.ro/p/cutie-melt-me-craciun-53g-cu-wax-melts-parfumate-waxmelts.html,https://boundlesscollection.ro/images/craciun/box-waxmelts-53g.jpg,20.00 RON,in stock,new,Boundless Collection,waxmelts-craciun-53g-001,Home & Garden > Decor > Candles,craciun
waxmelts-craciun-23g-001,Borcanel Craciun 23g cu wax melts parfumate,"Borcanas de Craciun cu aprox. 23g wax melts parfumate din ceara de soia 100% naturala. Figurine aromate in forme festive, ideale pentru arzator de esente si pentru a crea o atmosfera cozy de sarbatori. Perfecta ca mic cadou sau Secret Santa.",https://boundlesscollection.ro/p/borcanel-craciun-23g-cu-wax-melts-parfumate-waxmelts.html,https://boundlesscollection.ro/images/craciun/box-waxmelts-23g.jpg,15.00 RON,in stock,new,Boundless Collection,waxmelts-craciun-23g-001,Home & Garden > Decor > Candles,craciun
brad-floral-verde-ingeras-030,Brad floral Craciun cu ingeras si flori uscate,"Bradut decorativ de Craciun, realizat manual din floricele din ceara de soia. Model tip brad bogat in flori de iarna verde-menta, accente aurii, flori uscate si funda imprimata tematica; varf cu ingeras delicat. Piesa spectaculoasa pentru decor sau cadou premium de sarbatori. Ideal pentru decorul mesei de Craciun. Disponibila imediat bucata prezentata in imagine.",https://boundlesscollection.ro/p/brad-floral-craciun-cu-ingeras-si-flori-uscate-brad-flo.html,https://boundlesscollection.ro/images/craciun/brad-floral-verde-ingeras.jpg,299.99 RON,in stock,new,Boundless Collection,brad-floral-verde-ingeras-030,Home & Garden > Decor > Candles,craciun
box-craciun-waxmelts-100g-031,Box Craciun 100g cu wax melts parfumate,"Cutie cadou festiva cu wax melts parfumate, turnate manual din ceara de soia 100% naturala. Contine aprox. 100g de figurine aromate in forme de Craciun – omulet turta dulce, Mos Craciun, braduti, gnomi, acadele si cadouri. Cadoul perfect pentru iubitorii de arome de sarbatori.",https://boundlesscollection.ro/p/box-craciun-100g-cu-wax-melts-parfumate-box-crac.html,https://boundlesscollection.ro/images/craciun/box-waxmelts-100g.jpg,49.99 RON,in stock,new,Boundless Collection,box-craciun-waxmelts-100g-031,Home & Garden > Decor > Candles,craciun
box-craciun-waxmelts-40g-032,Box Craciun 40g cu wax melts parfumate,"Cutie cadou mica de Craciun cu aprox. 40g wax melts parfumate din ceara de soia, in forme de braduti. Aromă delicată, produs handmade perfect pentru un cadou festiv sau aromaterapie.",https://boundlesscollection.ro/p/box-craciun-40g-cu-wax-melts-parfumate-box-crac.html,https://boundlesscollection.ro/images/craciun/box-waxmelts-40g.jpg,25.00 RON,in stock,new,Boundless Collection,box-craciun-waxmelts-40g-032,Home & Garden > Decor > Candles,craciun
box-craciun-waxmelts-85g-033,Box Craciun 85g cu wax melts parfumate,"Cutie cadou de Craciun cu aprox. 85g wax melts parfumate din ceara de soia, in forme de braduti. Aromă festiva, perfectă pentru aromaterapie si cadouri elegante de sezon.",https://boundlesscollection.ro/p/box-craciun-85g-cu-wax-melts-parfumate-box-crac.html,https://boundlesscollection.ro/images/craciun/box-waxmelts-85g.jpg,40.00 RON,in stock,new,Boundless Collection,box-craciun-waxmelts-85g-033,Home & Garden > Decor > Candles,craciun
box-odorizante-dulap-craciun-034,Gift Set Crăciun – Odorizante dulap & Acadea parfumată,"Set festiv format din 2 odorizante pentru dulap din ceara de soia, decorate cu fulg albastru si crengute de brad, plus un wax melt acadea roz. Parfum intens, ideal pentru dulap, dressing, sertare sau cadouri elegante de Craciun.",https://boundlesscollection.ro/p/gift-set-craciun-odorizante-dulap-acadea-parfumata-box-odor.html,https://boundlesscollection.ro/images/craciun/box-odorizante-dulap.jpg,74.99 RON,in stock,new,Boundless Collection,box-odorizante-dulap-craciun-034,Home & Garden > Decor > Candles,craciun
gift-set-craciun-odorizante-bradut,Gift Set Crăciun – Odorizante dulap brăduț (2 buc) & Floare craciun,"Set festiv cu 2 odorizante brăduț din ceară de soia plus un wax melt, decorate manual cu frunze de ilex si poinsettia. Parfum intens, ideale pentru dulap, dressing, sertare sau ca un cadou elegant de Crăciun.",https://boundlesscollection.ro/p/gift-set-craciun-odorizante-dulap-bradut-2-buc-floare-craciun-gift-set.html,https://boundlesscollection.ro/images/craciun/odorizante-bradut-2buc.jpg,74.99 RON,in stock,new,Boundless Collection,gift-set-craciun-odorizante-bradut,Home & Garden > Decor > Candles,craciun
gift-set-craciun-odorizante-cafea-ilex,Gift Set Crăciun – Odorizante dulap Cafea & Ilex (2 buc),"Set cu 2 odorizante pentru dulap din ceară de soia – unul cu boabe de cafea, celălalt decorat cu ilex festiv. Parfum intens, ideale pentru dulap, dressing, sertare sau cadouri elegante de Crăciun.",https://boundlesscollection.ro/p/gift-set-craciun-odorizante-dulap-cafea-ilex-2-buc-gift-set.html,https://boundlesscollection.ro/images/craciun/odorizante-cafea-ilex-2buc.jpg,74.99 RON,in stock,new,Boundless Collection,gift-set-craciun-odorizante-cafea-ilex,Home & Garden > Decor > Candles,craciun
gift-set-craciun-odorizante-gingerbread-poinsettia,Gift Set Crăciun – Odorizante dulap Gingerbread & Poinsettia (2 buc),"Set festiv cu 2 odorizante pentru dulap din ceară de soia, decorate cu figurine de turtă dulce și floare poinsettia. Parfum intens și design premium – perfecte pentru dulap, dressing, spații mici sau ca și cadou elegant de Crăciun.",https://boundlesscollection.ro/p/gift-set-craciun-odorizante-dulap-gingerbread-poinsettia-2-buc-gift-set.html,https://boundlesscollection.ro/images/craciun/odorizante-gingerbread-poinsettia.jpg,84.99 RON,in stock,new,Boundless Collection,gift-set-craciun-odorizante-gingerbread-poinsettia,Home & Garden > Decor > Candles,craciun
gift-set-craciun-odorizante-portocala-scortisoara,Gift Set Crăciun – Odorizante dulap Portocală & Scorțișoară (2 buc),"Set festiv cu 2 odorizante pentru dulap din ceară de soia, decorate cu portocală deshidratată, baton de scorțișoară și elemente clasice de Crăciun. Parfum cald, condimentat și intens – ideal pentru dressing, dulap sau cadou rafinat de sărbători.",https://boundlesscollection.ro/p/gift-set-craciun-odorizante-dulap-portocala-scortisoara-2-buc-gift-set.html,https://boundlesscollection.ro/images/craciun/odorizante-portocala-scortisoara.jpg,84.99 RON,in stock,new,Boundless Collection,gift-set-craciun-odorizante-portocala-scortisoara,Home & Garden > Decor > Candles,craciun
box-macarons-waxmelts-10buc-036,Set Macarons Wax Melts - 10 bucati,"Set cadou cu 10 macarons wax melts parfumate, turnate manual din ceara de soia 100% naturala. Fiecare macaron este colorat diferit si are parfum intens, ideal pentru arzator de esente si pentru a crea o atmosfera cozy in casa. Perfect ca dar de Craciun, Secret Santa sau cadou pentru iubitorii de arome gurmande. Culorile si aromele se pot personaliza la comanda.",https://boundlesscollection.ro/p/set-macarons-wax-melts-10-bucati-box-maca.html,https://boundlesscollection.ro/images/craciun/box-macarons-waxmelts-10buc.jpg,79.99 RON,in stock,new,Boundless Collection,box-macarons-waxmelts-10buc-036,Home & Garden > Decor > Candles,craciun
box-craciun-waxmelts-ciorap-001,Box Craciun tip ciorap cu wax melts parfumate,"Cutie cadou tip ciorap de Craciun cu wax melts din ceara de soia, in forme festive (fulg, cadou, turta dulce, Mos). Parfum intens, ideal pentru cadou sau aromaterapie de sarbatori.",https://boundlesscollection.ro/p/box-craciun-tip-ciorap-cu-wax-melts-parfumate-box-crac.html,https://boundlesscollection.ro/images/craciun/box-waxmelts-ciorap.jpg,64.99 RON,in stock,new,Boundless Collection,box-craciun-waxmelts-ciorap-001,Home & Garden > Decor > Candles,craciun
lumanare-glob-om-zapada-001,Lumanare Craciun glob cu om de zapada,"Lumanare decorativa de Craciun in forma de glob cu om de zapada si brazi, ideala pentru cadou sau decor de sarbatori. Realizata manual din ceara de soia, cu detalii 3D fine si finisaj elegant. Arde uniform, fitil centrat.",https://boundlesscollection.ro/p/lumanare-craciun-glob-cu-om-de-zapada-lumanare.html,https://boundlesscollection.ro/images/craciun/lumanare-glob-om-zapada.jpg,55.00 RON,in stock,new,Boundless Collection,lumanare-glob-om-zapada-001,Home & Garden > Decor > Candles,craciun
